issue_id,observed_at,source_name,capability,severity,status,observed_schema,expected_schema,normalization_or_fallback,evidence_ids,owner,next_step
B8B-SCHEMA-001,2026-07-13,tushare,daily_price,low,resolved_alias,vol,volume,technical_snapshot_builder maps vol to volume,ev_structured_market_data_002837_20260713_66cd61,evidence-ingest,retain alias regression test
B8B-SCHEMA-002,2026-07-13,baostock,daily_price,low,resolved_alias,date,trade_date,technical_snapshot_builder accepts date and sorts ascending,ev_structured_market_data_002837_20260713_3145e0,evidence-ingest,retain date-order regression test
B8B-SCHEMA-003,2026-07-13,tushare,valuation_snapshot,low,resolved_alias,"trade_date,total_mv,circ_mv","as_of_date,market_cap,float_market_cap","valuation builder selects maximum date, maps aliases and declares 10k_CNY units",ev_structured_market_data_002837_20260713_f8cc52,evidence-ingest,quality review unit labels before promotion
B8B-SCHEMA-004,2026-07-13,baostock,financial_statements,medium,open_review,"code,pubDate,statDate","ts_code,ann_date,end_date",fallback tables remain draft and are not promoted through implicit field mapping,"ev_structured_financial_data_002837_20260713_4bdf72;ev_structured_financial_data_002837_20260713_cdf5ef;ev_structured_financial_data_002837_20260713_6a6186;ev_structured_financial_data_002837_20260713_65b0e2",evidence-ingest,add reviewed field map before registry promotion
B8B-SCHEMA-005,2026-07-13,tushare,event_calendar,medium,resolved_guard,"pre_date,actual_date,modify_date are numeric-looking date strings",non_metric_event_fields,structured_api_pull excludes event-date fields from numeric metric generation,ev_structured_financial_data_002837_20260713_a177f1,evidence-ingest,retain zero-metric event calendar regression test
B8B-SCHEMA-006,2026-07-13,eastmoney_push2,research_metadata,low,resolved_normalization,"camelCase reportapi payload under data[]",normalized snake_case metadata fields,eastmoney report adapter archives raw JSON and emits a bounded analyst-view table,ev_third_party_research_002837_20260713_20f610,evidence-ingest,monitor response fingerprint on refresh
